{
  "schema_version": "1.0",
  "request_id": "REQ-DEMO-001",
  "character_id": "CS-DEMO-001",
  "evidence_level": "Advanced",
  "layout_scope": "Complete",
  "status": "Approved-With-Limits",
  "limitations": [
    "Observed profile references are not available in this fictional example."
  ],
  "final_outputs": [
    "final/character-sheet.png",
    "final/character-sheet-preview.jpg"
  ]
}